<?xml version="1.0" encoding="UTF-8"?>

<departamentoIT
    empresa="TechSolutions"
    xmlns:xsi="http://www.w3.org/2001/XMLSchema-instance"
    xsi:noNamespaceSchemaLocation="Repaso_1b.xsd">

    <incidencia id="1" prioridad="alta">
        <fecha>2026-02-10</fecha>
        <equipo>PC-Oficina-01</equipo>
        <tipo>hardware</tipo>
        <descripcion>No enciende el equipo</descripcion>
        <tecnico>Juan Pérez</tecnico>
        <resuelta>no</resuelta>
    </incidencia>

    <incidencia id="2" prioridad="media">
        <fecha>2026-02-12</fecha>
        <equipo>Servidor-02</equipo>
        <tipo>red</tipo>
        <descripcion>Pérdida de conexión intermitente</descripcion>
        <tecnico>María García</tecnico>
        <resuelta>si</resuelta>
    </incidencia>

</departamentoIT>
